{
  "$schema": "https://json-schema.org/draft/2020-12/schema",
  "title": "AgentOps Project Onboarding Profile",
  "type": "object",
  "properties": {
    "project_identity": {
      "type": "string"
    },
    "github": {
      "type": "object",
      "properties": {
        "repository": { "type": "string" },
        "canonical_branch": { "type": "string" }
      },
      "required": ["repository", "canonical_branch"],
      "additionalProperties": false
    },
    "linear": {
      "type": "object",
      "properties": {
        "team_key": { "type": "string" },
        "project_id": { "type": "string" }
      },
      "required": ["team_key", "project_id"],
      "additionalProperties": false
    },
    "local_builder": {
      "type": "object",
      "properties": {
        "relative_path": { "type": "string" },
        "required_env_vars": { "type": "array", "items": { "type": "string" } }
      },
      "additionalProperties": false
    },
    "validation": {
      "type": "object",
      "properties": {
        "ci_command": { "type": "string" },
        "test_command": { "type": "string" }
      },
      "required": ["ci_command"],
      "additionalProperties": false
    },
    "reviewer_relay": {
      "type": "object",
      "properties": {
        "binding_type": { "type": "string" },
        "contact_uri": { "type": "string" }
      },
      "required": ["binding_type", "contact_uri"],
      "additionalProperties": false
    },
    "governance": {
      "type": "object",
      "properties": {
        "capabilities": {
          "type": "array",
          "items": { 
            "type": "string",
            "enum": ["independent_review", "status_report"]
          }
        },
        "required_gates": {
          "type": "array",
          "items": { 
            "type": "string",
            "enum": ["WAITING_PO_AUTH", "CHANGES_REQUESTED", "BLOCKED", "NEEDS_OWNER_DECISION"]
          }
        },
        "protected_project": { "type": "boolean", "default": false },
        "cross_project_allowed": { "type": "boolean", "default": false },
        "trusted_reviewers": {
          "type": "array",
          "items": { "type": "string" },
          "description": "GitHub logins whose formal review / PO decisions are executable (R6-P0-1). Empty/unset fails closed."
        }
      },
      "required": ["capabilities", "required_gates", "protected_project"],
      "additionalProperties": false
    }
  },
  "additionalProperties": false,
  "required": [
    "project_identity",
    "github",
    "linear",
    "validation",
    "reviewer_relay",
    "governance"
  ]
}
