{
  "project_identity": "GovernLoop",
  "github": {
    "repository": "liangzhipengdamon-maker/GovernLoop",
    "canonical_branch": "main"
  },
  "linear": {
    "team_key": "AGE",
    "project_id": "cf3dc03e-83df-4698-b8da-4efb37553d4a"
  },
  "local_builder": {
    "relative_path": ".",
    "required_env_vars": []
  },
  "validation": {
    "ci_command": "python -m unittest discover",
    "test_command": "PYTHONPATH=tools python -m unittest discover -s tools/governloop_runtime/tests"
  },
  "reviewer_relay": {
    "binding_type": "chatgpt-neutral-relay",
    "contact_uri": "relay://neutral/chatgpt"
  },
  "governance": {
    "capabilities": ["independent_review", "status_report"],
    "required_gates": ["WAITING_PO_AUTH", "CHANGES_REQUESTED", "BLOCKED", "NEEDS_OWNER_DECISION"],
    "protected_project": true,
    "cross_project_allowed": false,
    "trusted_reviewers": ["liangzhipengdamon-maker"]
  }
}
